{
  "$schema": "https://json-schema.org/draft/2020-12/schema",
  "$id": "https://aiengineeringfromscratch.com/manuals/manual.schema.json",
  "title": "Manual manifest",
  "description": "manual.json for one manual under manuals/<id>/. site/build-manuals.js enforces these rules on every build.",
  "type": "object",
  "required": ["id", "title", "subtitle", "summary", "audience", "edition", "status", "pin", "outcomes", "palette", "sources", "parts"],
  "additionalProperties": false,
  "$defs": {
    "hue": { "enum": ["grey", "blue", "teal", "violet", "green", "amber", "plum", "olive", "indigo", "rose"] },
    "doc": { "type": "string", "pattern": "^[a-z0-9/._-]+\\.md$" },
    "argv": { "type": "array", "minItems": 0, "items": { "type": "string", "minLength": 1 } },
    "date": { "type": "string", "pattern": "^\\d{4}-\\d{2}-\\d{2}$" }
  },
  "properties": {
    "id": { "type": "string", "pattern": "^[a-z0-9]+(?:-[a-z0-9]+)*$" },
    "title": { "type": "string", "minLength": 1 },
    "subtitle": { "type": "string", "minLength": 1 },
    "summary": { "type": "string", "minLength": 1 },
    "audience": { "type": "string", "minLength": 1 },
    "edition": { "type": "string", "pattern": "^\\d{4}\\.\\d{2}$" },
    "status": { "enum": ["draft", "ready"] },
    "pin": {
      "type": "object",
      "required": ["subject", "version", "source", "commit", "date", "verified"],
      "additionalProperties": false,
      "properties": {
        "subject": { "type": "string", "minLength": 1 },
        "version": { "type": "string", "minLength": 0 },
        "source": { "type": "string", "pattern": "^https://\\S+$" },
        "commit": { "type": "string", "minLength": 7 },
        "date": { "$ref": "#/$defs/date" },
        "verified": { "$ref": "#/$defs/date" }
      }
    },
    "outcomes": { "type": "array", "minItems": 3, "items": { "type": "string", "minLength": 1 } },
    "palette": {
      "type": "array",
      "minItems": 3,
      "items": {
        "type": "object",
        "required": ["hue", "meaning"],
        "additionalProperties": false,
        "properties": { "hue": { "$ref": "#/$defs/hue" }, "meaning": { "type": "string", "minLength": 1 } }
      }
    },
    "sources": {
      "type": "array",
      "minItems": 1,
      "items": {
        "type": "object",
        "required": ["name", "path", "usedFor"],
        "additionalProperties": false,
        "properties": { "name": { "type": "string" }, "path": { "type": "string" }, "usedFor": { "type": "string" } }
      }
    },
    "quoteSources": { "type": "object", "propertyNames": { "pattern": "^[a-z][a-z0-9-]*$" }, "additionalProperties": { "type": ["string", "null"] }, "description": "Source key to a vendored source file. null declares a key with no vendored file. Every source marker and every rule must use a declared key." },
    "capture": {
      "type": "object",
      "required": ["run", "check"],
      "additionalProperties": false,
      "properties": { "run": { "$ref": "#/$defs/argv" }, "check": { "$ref": "#/$defs/argv" }, "timeoutSeconds": { "type": "integer", "minimum": 1, "description": "How long the audit lets capture.check run. Default 300." } }
    },
    "front": { "$ref": "#/$defs/doc" },
    "plate": {
      "type": "object",
      "required": ["figure", "title", "caption"],
      "additionalProperties": true,
      "properties": { "figure": { "type": "string", "pattern": "^[a-z0-9]+(?:-[a-z0-9]+)*$" }, "title": { "type": "string", "minLength": 1 }, "caption": { "type": "string", "minLength": 1 } }
    },
    "parts": {
      "type": "array",
      "minItems": 2,
      "items": {
        "type": "object",
        "required": ["number", "title", "thesis", "accent", "sections"],
        "additionalProperties": false,
        "properties": {
          "number": { "type": "integer", "minimum": 1 },
          "title": { "type": "string", "minLength": 2 },
          "thesis": { "type": "string", "minLength": 1 },
          "summary": { "type": "string" },
          "accent": { "$ref": "#/$defs/hue" },
          "sections": {
            "type": "array",
            "minItems": 1,
            "items": {
              "type": "object",
              "required": ["id", "file"],
              "additionalProperties": false,
              "properties": { "id": { "type": "string", "pattern": "^\\d+\\.\\d+$" }, "file": { "$ref": "#/$defs/doc" } }
            }
          }
        }
      }
    },
    "reference": {
      "type": "object",
      "required": ["sections"],
      "additionalProperties": false,
      "properties": {
        "title": { "type": "string" },
        "thesis": { "type": "string" },
        "summary": { "type": "string" },
        "accent": { "$ref": "#/$defs/hue" },
        "sections": {
          "type": "array",
          "minItems": 1,
          "items": {
            "type": "object",
            "required": ["id", "file"],
            "additionalProperties": true,
            "properties": { "id": { "type": "string", "pattern": "^R\\.\\d+$" }, "file": { "$ref": "#/$defs/doc" } }
          }
        }
      }
    },
    "related": { "type": "array", "items": { "type": "string" } }
  }
}
